{
  "meta": {
    "source_title": "qingning_chosen",
    "genre": "campus-redemption",
    "extracted_at": "2026-08-11",
    "sample_chapters": [
      1,
      2,
      3,
      4,
      5,
      6,
      7,
      8,
      9,
      10,
      12,
      13,
      14,
      15,
      16,
      19,
      20,
      21,
      22,
      23,
      26,
      27
    ],
    "total_sample_words": 35714,
    "confidence": 0.9,
    "pass5_version": "1.2",
    "source_fingerprint": {
      "pass5_craft.json": "2195c0ee42524d98"
    }
  },
  "craft_analysis": {
    "foreshadowing": {
      "techniques": [
        {
          "name": "迟到者的动态切入",
          "description": "在人物首次或重要出场时，设计一个标志性的动态场景，通过动作、微表情和视线焦点来传递人物状态与潜在关系，替代静态描述。",
          "effect": "制造悬念与紧张感，迅速建立人物性格（匆忙、有目标感），并暗示人物关系（目光投向特定位置）。",
          "skeleton": "在人物出场时，不直接介绍身份，而是通过其匆忙、狼狈或充满张力的动作（如撞门、奔跑、抓书包带），结合外貌与神态的瞬间特写，塑造第一印象。",
          "anti_pattern": "作者不会平铺直叙“苏念是个学生，她今天迟到了”，而是让读者通过“‘哐当’撞门”、“额角沁汗”、“目光投向靠窗位置”这一系列动作自行拼凑信息。"
        },
        {
          "name": "无声的关怀动作",
          "description": "在表现角色间含蓄的情感时，设计一个看似自然发生、实则包含心意的微小物件状态变化或动作，让发现的过程成为情感爆发点。",
          "effect": "以小见大，含蓄而有力地展现人物细腻的关怀与隐藏的情感，制造“于无声处听惊雷”的感动，深化人物关系。",
          "skeleton": "通过一个极度细微、无需言语的日常动作（如拧开杯盖、挪书包），在平凡场景中制造情感冲击，刻画角色间心照不宣的默契与深情。",
          "anti_pattern": "作者不会让陆星辞直接说“我帮你准备了温水”，而是通过“保温杯盖子已被拧开，虚掩着，盛着温水”这个细节，让角色和读者自行发现。"
        },
        {
          "name": "象征性物件的传递",
          "description": "选择一个与情感核心契合的日常物件，详细描写其独特性，让它的出现、传递和被珍视的过程，完整地映射出情感的发生与发展。",
          "effect": "将抽象的情感具象化为可触碰、可珍藏的实物，使情感表达更扎实、更持久，成为贯穿情节的线索和情感记忆的锚点。",
          "skeleton": "让一个具有私密属性或专属感的物件（如深蓝色笔记本、姜汤）在角色间传递，该物件承载了超越其物理属性的情感重量，成为关系转折或情感累积的符号。",
          "anti_pattern": "作者不会只写“陆星辞借给苏念一个笔记本”，而是详细描写这个笔记本的外观（深蓝色、有磨损）、内容（多色笔批注、小说化注解），使其成为独一无二的“心意之物”。"
        }
      ]
    },
    "information_release": {
      "techniques": [
        {
          "name": "自我合理化的内心独白",
          "description": "在角色做出情感倾向明显的举动后，紧接着插入一段其说服自己的心理活动，理由要符合其性格和一贯行为逻辑，让借口本身成为反证。",
          "effect": "含蓄地揭示角色潜意识中的真实情感，同时强化其性格特质（如别扭、傲娇），增加角色的层次感和真实感，让读者会心一笑。",
          "skeleton": "当角色做出超越日常界限的举动后，立刻用一套合理的、符合其人设的借口（如“只是邻居”、“清除干扰项”）来为自己的行为辩护，从而含蓄地暴露真实情感。",
          "anti_pattern": "作者不会直接说“陆星辞其实喜欢苏念”，而是写他为苏念整理错题后，在心里告诉自己“这只是因为邻居情分和影响学习”。"
        }
      ]
    },
    "pov_control": {
      "techniques": [
        {
          "name": "通过他人视角侧写主角",
          "description": "在需要突出某个角色特质时，设计一个观察者角色，通过其眼睛看、内心想（可插入回忆或他人评价）的方式，将评价转化为具象的观察与心理活动。",
          "effect": "使角色魅力更具说服力和代入感，同时细腻刻画观察者（苏念）的内心波澜，实现一石二鸟的效果。",
          "skeleton": "在塑造一个角色（如高冷男主）时，不直接进行全知全能的描写，而是通过另一个角色（如暗恋者）的观察和内心活动来烘托其特质与魅力。",
          "anti_pattern": "作者不会脱离情境直接写“陆星辞非常英俊”，而是通过苏念的内心独白（“上帝精心雕琢的艺术品”、“清冷校草”）和闺蜜的感叹来间接呈现。"
        },
        {
          "name": "内心戏与外部反应的错位",
          "description": "在描写角色内心剧烈波动时，同步描写其试图维持常态的肢体语言和微表情，让读者同时看到冰山下的涌动与冰山上的平静。",
          "effect": "深刻刻画暗恋或紧张心理，突出角色性格的克制或腼腆，并通过反差感增强读者的代入感和共鸣。",
          "skeleton": "在角色进行内心激烈活动（如慌乱、心动）时，刻意描写其外在的极力克制（如低头、假装修书），形成强烈反差，增强戏剧张力。",
          "anti_pattern": "作者不会让苏念直接脸红并大声说话，而是写她“心里疯狂尖叫，手指捏紧书页，耳根发烫”，同时陆星辞“只是淡淡看了一眼，仿佛无意”。"
        }
      ]
    },
    "scene_transition": {
      "techniques": [
        {
          "name": "环境氛围渲染",
          "description": "在需要建立场景真实感与情绪氛围时，调动视觉（光斑）、听觉（铃声、喘息）、嗅觉（粉笔灰、皂角）等多重感官描写，避免概括性评价。",
          "effect": "快速将读者带入校园清晨的具体场景，奠定清新、鲜活、略带紧张感的叙事基调，增强沉浸感。",
          "skeleton": "在开篇或场景转换时，通过描写光线、声音、气味等感官细节，营造特定的时空氛围与情绪基调。",
          "anti_pattern": "作者不会直接概括性地说“这是一个美好的清晨”，而是用具体的感官细节（晨光、粉笔灰、皂角气息、翻书声）来构建画面。"
        }
      ]
    },
    "tension_building": {
      "techniques": [
        {
          "name": "以等待期拉长情绪张力",
          "description": "在关键结果揭晓前（录取结果、对方回应），作者故意铺陈一段漫长的等待期，用“查询天气、规划路线、反复确认消息”等日常动作把悬念的时间拉长。",
          "effect": "等待本身成为情绪的蓄水池，读者与角色一起经历“煎熬”，让最终揭晓时刻的情感冲击被放大数倍。",
          "skeleton": "在关键节点（告白/揭榜/回信）前后，插入一段被拉长的等待期，用琐碎却充满期待的日常动作填充，把“结果”的兑现一再推迟，积累情绪势能。",
          "anti_pattern": "作者不会让结果立刻揭晓，而是刻意延缓，用等待期的甜蜜煎熬来抬高最终兑现的分量。"
        },
        {
          "name": "以环境物象暗示情绪升温",
          "description": "用茉莉花开、雨丝、斑驳光影等环境物象的变化，暗示人物内心的情绪起伏，让环境成为情绪的外化而非单纯的布景。",
          "effect": "通过环境细节的“拟情”处理，让情感张力在不动声色中渗透出来，避免了直白的心理倾诉，符合青春暗恋含蓄克制的基调。",
          "skeleton": "在情感推进的节点，让环境物象（花、雨、光）与人物心绪同步变化，用物的状态映射情的起伏，让读者从环境读心。",
          "anti_pattern": "作者不会直接写“她很紧张/很甜蜜”，而是借环境物象（茉莉清香、斑驳光斑）来间接呈现情绪。"
        }
      ],
      "peak_valley_pattern": "情绪呈“缓慢爬升—小高潮—回落”的波浪式推进，几乎无激烈冲突，张力主要靠等待与暗恋的“未言明”来维持，属于慢热型张力曲线。"
    },
    "dialogue_craft": {
      "techniques": [
        {
          "name": "内心独白与说出口的话错位",
          "description": "角色心里想的是一套（心动、慌乱、哀嚎），嘴上说出口的却是另一套（嘴硬、否认、故作镇定），用内心戏与台词的强烈反差制造喜剧感和真实感。",
          "effect": "暗恋者的“口是心非”被放大，读者既能代入其真实心动，又能被其笨拙的掩饰逗笑，情感真实度与趣味性兼得。",
          "skeleton": "在对话中穿插角色未说出口的内心独白，让“心里话”与“说出口的话”形成反差，用错位呈现人物口是心非的可爱与真实。",
          "anti_pattern": "作者不会让角色心口如一地直接表白，而是让“想说的”和“说出的”长期错位，靠错位维持暧昧与悬念。"
        },
        {
          "name": "以沉默与肢体替代言语回应",
          "description": "男主常以沉默、低头、淡淡一瞥等非语言动作来回应女主的言语，用“不说话”本身传递克制的在意。",
          "effect": "沉默制造了留白，让读者去揣测男主的真实态度，强化其“清冷克制”的人设，同时为情感留有想象空间。",
          "skeleton": "给内敛角色设计“用沉默/微动作代替语言回应”的对话模式，让关键情感的传递通过不回应、眼神、动作的细微变化来完成。",
          "anti_pattern": "作者不会让高冷男主滔滔不绝地解释，而是用沉默和微表情来承载情感，让“没说的话”比“说的话”更有分量。"
        },
        {
          "name": "借他人之口侧写主角",
          "description": "通过闺蜜的感叹、旁观者的评价（“上帝精心雕琢的艺术品”）来间接呈现男主的魅力，而非直接描写。",
          "effect": "评价被装进他人口中，显得客观可信，又自然融入了女主的视角和情绪，一石二鸟地完成角色塑造与关系暗示。",
          "skeleton": "用配角之口（闺蜜、同学、路人）对主角进行评价或感叹，把作者想说的赞美转交给角色，既塑造被评者，也刻画了评者的视角与情感。",
          "anti_pattern": "作者不会用全知视角直接夸男主英俊，而是借闺蜜或女主的内心感叹来间接传递，避免直白。"
        }
      ],
      "subtext_ratio": 0.8
    },
    "rhythm_control": {
      "techniques": [
        {
          "name": "以“慢放”手法放大心动瞬间",
          "description": "在关键的心动、重逢、告别等瞬间，作者刻意把时间拉慢，逐帧描写动作、光影、呼吸，让短暂的一刻在叙事中被延长。",
          "effect": "慢放让情感瞬间被“放大镜”审视，读者得以细细品味角色内心的每一次波动，强化青春暗恋的细腻与珍贵。",
          "skeleton": "在情感高潮的瞬间（对视/牵手/告别），把叙事速度调到最慢，用大量细节逐格拆解这个瞬间，让读者与角色同步沉入。",
          "anti_pattern": "作者不会让心动瞬间一笔带过，而是刻意放慢，用慢放来凸显这一刻在人物心中的分量。"
        },
        {
          "name": "以时间跳跃压缩过渡段落",
          "description": "在等待、日常等非关键段落，作者用“填报志愿后的日子”“录取通知书寄到那天”等时间跳跃快速略过，只保留与情感相关的片段。",
          "effect": "无关紧要的日常被压缩，读者的注意力被精准导向情感发展的关键节点，保持节奏的紧凑与情感主线的高浓度。",
          "skeleton": "对过渡性的日常用时间跳跃快速带过（“那些日子”“后来”），只挑与情感推进相关的片段详写，实现详略得当。",
          "anti_pattern": "作者不会事无巨细地记录每一天，而是用时间跳跃跳过平淡，把笔墨集中在情感的节点上。"
        }
      ],
      "tempo_shift_triggers": "以“心动/重逢/告别”等情感节点触发慢放，以“日常/等待”触发时间跳跃快进，整体节奏跟随情感浓度起伏，属于情感驱动型节奏。"
    },
    "sensory_craft": {
      "techniques": [
        {
          "name": "嗅觉作为情感记忆的触发器",
          "description": "作者大量运用嗅觉（茉莉花香、皂角气息、粉笔灰、饭菜香）来触发人物的情感记忆和场景氛围，嗅觉成为情绪的关键入口。",
          "effect": "嗅觉是最能唤起记忆的感官，用气味锚定场景，能瞬间把读者和角色拉回某个特定的情感时刻，营造沉浸式的青春气息。",
          "skeleton": "在建立场景或触发回忆时，优先调用嗅觉（花香/饭香/皂角/雨后泥土味），让气味成为情感的“开关”，一笔带出氛围与记忆。",
          "anti_pattern": "作者不会只用视觉写景，而是刻意加入嗅觉细节，用气味来丰富场景的质感与情感层次。"
        },
        {
          "name": "多重感官交织渲染场景",
          "description": "在同一场景中同时调动视觉（光斑）、听觉（铃声、喘息、翻书声）、嗅觉（粉笔灰、皂角）、触觉（发烫的耳根）等多重感官，避免单一维度的描写。",
          "effect": "多感官交织让场景立体、可感、可触，读者仿佛置身其中，青春的鲜活与悸动被完整传达。",
          "skeleton": "在场景描写中，刻意轮换视觉、听觉、嗅觉、触觉，至少叠加两到三种感官，让画面从“看得见”升级为“感得到”。",
          "anti_pattern": "作者不会只靠视觉堆砌形容词，而是让多种感官协同，避免场景扁平化。"
        },
        {
          "name": "触觉外化内心生理反应",
          "description": "用心跳、发烫的耳根、捏紧的书页、发凉的指尖等触觉与生理反应来外化角色的内心情绪，而非直接陈述。",
          "effect": "把抽象的“紧张、心动、慌乱”转化为可感的生理细节，读者通过身体感受代入情绪，真实且克制。",
          "skeleton": "在角色情绪波动时，用触觉/生理反应（耳根发烫、指尖发凉、心跳加速、捏紧衣角）来替代心理独白，让身体替情绪说话。",
          "anti_pattern": "作者不会直接写“她很紧张”，而是写“耳根烧起来”“手指捏紧书页”，用身体反应间接传递。"
        }
      ],
      "dominant_sense": "嗅觉（情感记忆触发器）+ 触觉（内心生理外化），视觉退居其次，服务于氛围而非信息。",
      "rare_sense_usage": "味觉较少使用，仅在“饭菜”“甜”等隐喻性场景中偶现，且多与情感记忆绑定。"
    },
    "narrative_engine": {
      "techniques": [
        {
          "name": "暗恋的“未言明”悬念驱动",
          "description": "男女主互相在意却都不说破，读者始终被“什么时候捅破这层窗户纸”牵引，暗恋的暧昧与不确定本身就是持续的追读动力。",
          "effect": "暧昧关系自带“何时表白/何时在一起”的天然悬念，读者为这个“未完成”的状态持续追读，情感悬念成为最强翻页引擎。",
          "skeleton": "让双箭头的情感长期处于“心照不宣但未言明”的暧昧状态，用一个个“差一点说出口”的瞬间反复撩拨读者，把捅破窗户纸的节点不断后移。",
          "anti_pattern": "作者不会让两人过早挑明关系，而是把暧昧维持到情感张力最大的临界点再兑现。"
        },
        {
          "name": "象征物的传递-珍视循环",
          "description": "一件承载心意的物件（笔记本、错题集）在两人间传递、被珍视、被反复想起，物件的流转构成贯穿全文的情感线索。",
          "effect": "物件成为情感的实体锚点，读者通过关注“这件东西最后怎么样了”来追读，情感有了可触的载体，回忆与期待都被它勾连。",
          "skeleton": "设定一件有情感象征意义的物件，让它在关键节点反复出现、传递、被珍藏，用物件的命运串起情感线，制造“物件级”的牵挂。",
          "anti_pattern": "作者不会让象征物只出现一次，而是让它反复登场，每次出现都加深一层情感记忆。"
        }
      ],
      "primary_driver": "情感悬念（暗恋何时挑明）> 象征物牵挂 > 信息差"
    },
    "emotional_algorithm": {
      "techniques": [
        {
          "name": "反差萌的情感表达",
          "description": "为角色设计一个核心人设标签（如“高冷”），然后围绕其关心的对象，创造一个完全违背该标签的、具体而微的专属行为，让反差本身成为情感的最佳注脚。",
          "effect": "颠覆读者对角色的固有认知，凸显情感的真挚与独特性，制造惊喜感和巨大的感动，是刻画“隐藏深情”的利器。",
          "skeleton": "让一个以冷静、克制著称的角色，做出与其人设看似矛盾的、笨拙或深情的举动（如用仙侠小说讲数学题），从而产生强烈的反差感与情感冲击力。",
          "anti_pattern": "作者不会让陆星辞直接表达关心，而是设计了“将仙侠小说设定代入错题集”这个与其“冰山脸”人设反差极大的行为，让关心显得隐秘又用心。"
        }
      ]
    }
  },
  "craft_summary": {
    "top_3_strengths": [
      "环境氛围渲染",
      "迟到者的动态切入",
      "通过他人视角侧写主角"
    ],
    "unique_techniques": [
      "无声的关怀动作",
      "内心戏与外部反应的错位"
    ],
    "reusable_patterns": [
      "环境氛围渲染",
      "迟到者的动态切入",
      "通过他人视角侧写主角"
    ]
  },
  "provenance": {
    "contains_verbatim": false,
    "abstraction_note": "Pass5 v1.2 (10-dim)"
  }
}