{
  "meta": {
    "source_title": "sangshi_chosen",
    "genre": "campus-redemption",
    "extracted_at": "2026-08-11",
    "sample_chapters": [
      1,
      2,
      3,
      4,
      5,
      6,
      7,
      8,
      9,
      10,
      12,
      13,
      14,
      15,
      16,
      19,
      20,
      21,
      22,
      23,
      26,
      27
    ],
    "total_sample_words": 33899,
    "confidence": 0.9,
    "pass5_version": "1.2"
  },
  "craft_analysis": {
    "foreshadowing": {
      "techniques": [
        {
          "name": "在塑造一个对重复高中生活感到极度痛苦的角色时，使用了重复句式来构建情感递进。",
          "description": "用“她活了二十四年”、“她的人生平平无奇”、“没遗憾”、“没悲剧”等一系列否定性陈述，铺垫一个“无意义”的普通人生，然后突然用“她穿越了”这一唯一“称奇”的事件进行转折，强化事件的荒诞感。",
          "effect": "建立角色的平凡基底，使后续穿越事件的冲击力最大化，并快速引发读者对角色遭遇的共情。",
          "skeleton": "用连续的日常状态描写（A是普通的，B是普通的，C是普通的…）与一个颠覆性的异常事件（X）并列，通过对比强调事件的冲击力和角色的内心失衡。",
          "anti_pattern": "不会直接写“她穿越了，感到很震惊”，而是先详细描述她此前生活的“无趣”与“普通”，让“穿越”成为打破这种常态的唯一变量。"
        },
        {
          "name": "在引入关键人物并揭示核心情感时，使用“第一眼反应”与后续内心回溯相结合。",
          "description": "当周砚进入医务室时，描写桑幼的身体反应（眼眶发热、想哭），然后立刻回溯解释这是源于“八年的暗恋”和“错过的人”，将瞬间的情绪爆发锚定在长期的情感背景上。",
          "effect": "高效建立角色关系的深度和情感重量，制造悬念（为什么如此激动？），并让读者迅速理解角色行为的内在逻辑。",
          "skeleton": "角色A见到角色B时，产生强烈的即时情绪反应（如哭泣冲动），随后通过一句内心独白或简短回溯（“因为…”）揭示该反应的深层历史原因，瞬间完成情感铺垫。",
          "anti_pattern": "不会在见面后花大篇幅回溯，而是用一个精准的短句（“她错过了一个人”）点明核心，让情绪先行，解释随后。"
        },
        {
          "name": "在需要表现角色长期、无果的暗恋心理时，使用“具体行为列表”的虚化处理。",
          "description": "列举桑幼为暗恋所发的“誓”（打招呼、写情书、要联系方式），但立刻用“一个也没完成”来否定所有，以未行动的清单表现其爱的怯懦与深埋。",
          "effect": "刻画出“爱在心底口难开”的经典暗恋心理，塑造角色怯懦、隐忍的性格，并为其重生后行为的改变埋下伏笔。",
          "skeleton": "通过列举角色计划或希望为某事/某人做的具体行动（A, B, C…），然后全部以“从未实现”来结尾，用“未发生的行为”来反衬情感的强烈与行动的缺失。",
          "anti_pattern": "不会写她如何去尝试接近失败，而是聚焦于她连尝试的勇气都没有，用“未做”来体现性格和情感深度。"
        },
        {
          "name": "在解释角色重大人生转折（如死讯）对主角的影响时，使用碎片化信息与强烈生理反应的组合。",
          "description": "通过群聊的模糊、非正式信息（“通过模糊的非正式渠道传递死讯”）传递死讯，接着描写桑幼剧烈的生理反应（胃绞痛、流泪、慌乱翻找），用信息的不确定性对比情感冲击的确定性。",
          "effect": "强化该事件对角色的个人化冲击，暗示其情感世界的私密与沉重，并让读者感受到角色的孤独与无助。",
          "skeleton": "让重要信息通过间接、不可靠的渠道（他人议论、模糊消息）传递给角色，角色随后产生远超信息确凿程度的强烈身心反应，凸显该信息对其的私密重要性。",
          "anti_pattern": "不会通过正式通知或确切告知来传递消息，而是用二手、模糊的传闻，更强调主角个人情感世界与外部信息流的隔离与碰撞。"
        }
      ]
    },
    "information_release": {
      "techniques": [
        {
          "name": "在塑造一个表面冷淡但内心细腻的角色时，使用反差极大的对话与后续行为。",
          "description": "让周砚用极简、甚至带点疏离感的单字（“嗯”）回应桑幼，但随后又主动询问原因、为她调高空调温度，用行动补充言语的冷淡。",
          "effect": "制造角色的神秘感和吸引力，让读者像桑幼一样去揣摩和解读其真实意图，增加情感张力。",
          "skeleton": "角色A的对话内容极度简短、克制甚至冷漠，但紧接着的行为却展现出细致或关怀，通过“言语-行为”的反差揭示其真实性格。",
          "anti_pattern": "不会让角色突然变得健谈或热情，而是用细微的行动（调空调、给药）来传递未说出口的关切，保持外冷内热的人设。"
        }
      ]
    },
    "pov_control": {
      "techniques": [
        {
          "name": "在开篇快速建立角色核心矛盾时，使用内心独白与外部环境的强烈反差。",
          "description": "让角色在烈日军训的艰苦外部环境下，内心持续活动（从想死、回忆普通人生到分析穿越），形成“身体受苦”与“精神痛苦”的双重困境。",
          "effect": "立体展现角色困境，让读者同步感受其身体与心理的双重煎熬，增强代入感和故事的张力。",
          "skeleton": "在描写角色承受具体生理不适（如炎热、疲劳）的同时，穿插其复杂的情绪或回忆，让外部压力成为内心活动的催化剂。",
          "anti_pattern": "不会单独描写军训的苦或内心的想，而是将两者交织，使环境成为情绪的放大器。"
        }
      ]
    },
    "scene_transition": {
      "techniques": []
    },
    "tension_building": {
      "techniques": []
    },
    "dialogue_craft": {
      "techniques": []
    },
    "rhythm_control": {
      "techniques": []
    },
    "sensory_craft": {
      "techniques": []
    },
    "narrative_engine": {
      "techniques": []
    },
    "emotional_algorithm": {
      "techniques": []
    }
  },
  "craft_summary": {
    "top_3_strengths": [
      "在塑造一个对重复高中生活感到极度痛苦的角色时，使用了重复句式来构建情感递进。",
      "在开篇快速建立角色核心矛盾时，使用内心独白与外部环境的强烈反差。",
      "在引入关键人物并揭示核心情感时，使用“第一眼反应”与后续内心回溯相结合。"
    ],
    "unique_techniques": [
      "在需要表现角色长期、无果的暗恋心理时，使用“具体行为列表”的虚化处理。",
      "在解释角色重大人生转折（如死讯）对主角的影响时，使用碎片化信息与强烈生理反应的组合。"
    ],
    "reusable_patterns": [
      "在塑造一个对重复高中生活感到极度痛苦的角色时，使用了重复句式来构建情感递进。",
      "在开篇快速建立角色核心矛盾时，使用内心独白与外部环境的强烈反差。",
      "在引入关键人物并揭示核心情感时，使用“第一眼反应”与后续内心回溯相结合。"
    ]
  },
  "provenance": {
    "contains_verbatim": false,
    "abstraction_note": "Pass5 v1.2 (10-dim)"
  }
}